"X any vehicle licensed for road use or any other mechanically propelled vehicle such as cycle or buggy and their parts, keys and accessories,  "
"X any caravan, trailer or horsebox, and their parts, keys and accessories  "
"X any watercraft, hovercraft, aircraft, drone or other aerial device,  "
"X any living creature,  "
"X any building,  "
"X any land or water,  "
"X securities certificates and documents, except driving licences and passports,  "
"X any item used for your trade or profession except business equipment, or  "
X any item attached to any of the above.  
